{
  "schemaVersion": "1.0",
  "documentationType": "changes",
  "validateAgainst": "changes-schema.json",
  "module": "Standards/documentation",
  "changes": [
    {
      "version": "1.0.0",
      "date": "2025-10-29",
      "type": "major",
      "automationHooks": {
        "beforeApply": ["validate-structure", "check-links"],
        "afterApply": ["update-related-docs", "notify-teams"]
      },
      "changes": {
        "added": [
          {
            "component": "documentation",
            "items": [
              {
                "type": "structure",
                "description": "Initial documentation structure",
                "affects": ["all-modules"]
              },
              {
                "type": "template",
                "description": "Documentation templates",
                "files": ["template.md"]
              }
            ]
          }
        ],
        "relatedChanges": {
          "documents": [
            "README.md",
            "Standards/*/README.md"
          ],
          "configuration": [
            "documentation-config.json"
          ]
        }
      }
    }
  ]
}